{
  "format": "scene_traj",
  "version": 1,
  "cell_size": 1.0,
  "angle_units": "rad",
  "scene": {
    "objects": [
      {
        "type": "border",
        "n": 49,
        "color": [
          140,
          190,
          140
        ]
      }
    ]
  },
  "agents": [
    {
      "name": "slow",
      "color": [
        200,
        80,
        80
      ],
      "radius": 0.9,
      "body": "ball",
      "trajectory": [
        [
          0.0,
          6.0,
          12.0,
          0.0
        ],
        [
          0.181,
          6.181,
          12.0,
          0.0
        ],
        [
          0.362,
          6.362,
          12.0,
          0.0
        ],
        [
          0.543,
          6.543,
          12.0,
          0.0
        ],
        [
          0.724,
          6.724,
          12.0,
          0.0
        ],
        [
          0.905,
          6.905,
          12.0,
          0.0
        ],
        [
          1.085,
          7.085,
          12.0,
          0.0
        ],
        [
          1.266,
          7.266,
          12.0,
          0.0
        ],
        [
          1.447,
          7.447,
          12.0,
          0.0
        ],
        [
          1.628,
          7.628,
          12.0,
          0.0
        ],
        [
          1.809,
          7.809,
          12.0,
          0.0
        ],
        [
          1.99,
          7.99,
          12.0,
          0.0
        ],
        [
          2.171,
          8.171,
          12.0,
          0.0
        ],
        [
          2.352,
          8.352,
          12.0,
          0.0
        ],
        [
          2.533,
          8.533,
          12.0,
          0.0
        ],
        [
          2.714,
          8.714,
          12.0,
          0.0
        ],
        [
          2.894,
          8.894,
          12.0,
          0.0
        ],
        [
          3.075,
          9.075,
          12.0,
          0.0
        ],
        [
          3.256,
          9.256,
          12.0,
          0.0
        ],
        [
          3.437,
          9.437,
          12.0,
          0.0
        ],
        [
          3.618,
          9.618,
          12.0,
          0.0
        ],
        [
          3.799,
          9.799,
          12.0,
          0.0
        ],
        [
          3.98,
          9.98,
          12.0,
          0.0
        ],
        [
          4.161,
          10.161,
          12.0,
          0.0
        ],
        [
          4.342,
          10.342,
          12.0,
          0.0
        ],
        [
          4.523,
          10.523,
          12.0,
          0.0
        ],
        [
          4.704,
          10.704,
          12.0,
          0.0
        ],
        [
          4.884,
          10.884,
          12.0,
          0.0
        ],
        [
          5.065,
          11.065,
          12.0,
          0.0
        ],
        [
          5.246,
          11.246,
          12.0,
          0.0
        ],
        [
          5.427,
          11.427,
          12.0,
          0.0
        ],
        [
          5.608,
          11.608,
          12.0,
          0.0
        ],
        [
          5.789,
          11.789,
          12.0,
          0.0
        ],
        [
          5.97,
          11.97,
          12.0,
          0.0
        ],
        [
          6.151,
          12.151,
          12.0,
          0.0
        ],
        [
          6.332,
          12.332,
          12.0,
          0.0
        ],
        [
          6.513,
          12.513,
          12.0,
          0.0
        ],
        [
          6.693,
          12.693,
          12.0,
          0.0
        ],
        [
          6.874,
          12.874,
          12.0,
          0.0
        ],
        [
          7.055,
          13.055,
          12.0,
          0.0
        ],
        [
          7.236,
          13.236,
          12.0,
          0.0
        ],
        [
          7.417,
          13.417,
          12.0,
          0.0
        ],
        [
          7.598,
          13.598,
          12.0,
          0.0
        ],
        [
          7.779,
          13.779,
          12.0,
          0.0
        ],
        [
          7.96,
          13.96,
          12.0,
          0.0
        ],
        [
          8.141,
          14.141,
          12.0,
          0.0
        ],
        [
          8.322,
          14.322,
          12.0,
          0.0
        ],
        [
          8.503,
          14.503,
          12.0,
          0.0
        ],
        [
          8.683,
          14.683,
          12.0,
          0.0
        ],
        [
          8.864,
          14.864,
          12.0,
          0.0
        ],
        [
          9.045,
          15.045,
          12.0,
          0.0
        ],
        [
          9.226,
          15.226,
          12.0,
          0.0
        ],
        [
          9.407,
          15.407,
          12.0,
          0.0
        ],
        [
          9.588,
          15.588,
          12.0,
          0.0
        ],
        [
          9.769,
          15.769,
          12.0,
          0.0
        ],
        [
          9.95,
          15.95,
          12.0,
          0.0
        ],
        [
          10.131,
          16.131,
          12.0,
          0.0
        ],
        [
          10.312,
          16.312,
          12.0,
          0.0
        ],
        [
          10.492,
          16.492,
          12.0,
          0.0
        ],
        [
          10.673,
          16.673,
          12.0,
          0.0
        ],
        [
          10.854,
          16.854,
          12.0,
          0.0
        ],
        [
          11.035,
          17.035,
          12.0,
          0.0
        ],
        [
          11.216,
          17.216,
          12.0,
          0.0
        ],
        [
          11.397,
          17.397,
          12.0,
          0.0
        ],
        [
          11.578,
          17.578,
          12.0,
          0.0
        ],
        [
          11.759,
          17.759,
          12.0,
          0.0
        ],
        [
          11.94,
          17.94,
          12.0,
          0.0
        ],
        [
          12.121,
          18.121,
          12.0,
          0.0
        ],
        [
          12.302,
          18.302,
          12.0,
          0.0
        ],
        [
          12.482,
          18.482,
          12.0,
          0.0
        ],
        [
          12.663,
          18.663,
          12.0,
          0.0
        ],
        [
          12.844,
          18.844,
          12.0,
          0.0
        ],
        [
          13.025,
          19.025,
          12.0,
          0.0
        ],
        [
          13.206,
          19.206,
          12.0,
          0.0
        ],
        [
          13.387,
          19.387,
          12.0,
          0.0
        ],
        [
          13.568,
          19.568,
          12.0,
          0.0
        ],
        [
          13.749,
          19.749,
          12.0,
          0.0
        ],
        [
          13.93,
          19.93,
          12.0,
          0.0
        ],
        [
          14.111,
          20.111,
          12.0,
          0.0
        ],
        [
          14.291,
          20.291,
          12.0,
          0.0
        ],
        [
          14.472,
          20.472,
          12.0,
          0.0
        ],
        [
          14.653,
          20.653,
          12.0,
          0.0
        ],
        [
          14.834,
          20.834,
          12.0,
          0.0
        ],
        [
          15.015,
          21.015,
          12.0,
          0.0
        ],
        [
          15.196,
          21.196,
          12.0,
          0.0
        ],
        [
          15.377,
          21.377,
          12.0,
          0.0
        ],
        [
          15.558,
          21.558,
          12.0,
          0.0
        ],
        [
          15.739,
          21.739,
          12.0,
          0.0
        ],
        [
          15.92,
          21.92,
          12.0,
          0.0
        ],
        [
          16.101,
          22.101,
          12.0,
          0.0
        ],
        [
          16.281,
          22.281,
          12.0,
          0.0
        ],
        [
          16.462,
          22.462,
          12.0,
          0.0
        ],
        [
          16.643,
          22.643,
          12.0,
          0.0
        ],
        [
          16.824,
          22.824,
          12.0,
          0.0
        ],
        [
          17.005,
          23.005,
          12.0,
          0.0
        ],
        [
          17.186,
          23.186,
          12.0,
          0.0
        ],
        [
          17.367,
          23.367,
          12.0,
          0.0
        ],
        [
          17.548,
          23.548,
          12.0,
          0.0
        ],
        [
          17.729,
          23.729,
          12.0,
          0.0
        ],
        [
          17.91,
          23.91,
          12.0,
          0.0
        ],
        [
          18.09,
          24.09,
          12.0,
          0.0
        ],
        [
          18.271,
          24.271,
          12.0,
          0.0
        ],
        [
          18.452,
          24.452,
          12.0,
          0.0
        ],
        [
          18.633,
          24.633,
          12.0,
          0.0
        ],
        [
          18.814,
          24.814,
          12.0,
          0.0
        ],
        [
          18.995,
          24.995,
          12.0,
          0.0
        ],
        [
          19.176,
          25.176,
          12.0,
          0.0
        ],
        [
          19.357,
          25.357,
          12.0,
          0.0
        ],
        [
          19.538,
          25.538,
          12.0,
          0.0
        ],
        [
          19.719,
          25.719,
          12.0,
          0.0
        ],
        [
          19.899,
          25.899,
          12.0,
          0.0
        ],
        [